{
  "schema": "mnstry.source-sidecar@v1",
  "asset": "source.html",
  "title": "Sample Source",
  "summary": "Neutral non-Markdown source with durable sidecar identity.",
  "tags": [
    "sample"
  ],
  "kg": {
    "id": "sample-workspace:source-html",
    "type": "source",
    "domain": "sample",
    "lifecycle": "source",
    "status": "active",
    "audience": "private",
    "relations": {}
  }
}
