{
  "schema": "mnstry.source-sidecar@v1",
  "asset": "data.json",
  "title": "Sample dataset",
  "summary": "Neutral JSON dataset described entirely by its sidecar.",
  "tags": [
    "sample"
  ],
  "kg": {
    "id": "source-formats:data-json",
    "type": "source",
    "domain": "sample",
    "lifecycle": "source",
    "status": "active",
    "audience": "team",
    "relations": {}
  }
}
