{
  "schema": "mnstry.source-sidecar@v1",
  "asset": "pipeline.yaml",
  "title": "Sample pipeline",
  "summary": "Neutral YAML file; atelier never parses it, the sidecar speaks for it.",
  "tags": [
    "sample"
  ],
  "kg": {
    "id": "source-formats:pipeline-yaml",
    "type": "source",
    "domain": "sample",
    "lifecycle": "source",
    "status": "active",
    "audience": "public",
    "relations": {}
  }
}
